,id,text,clean,sent,username,chatroom,mention,ngrams,involved,back_and_forth,bigrams,discussionId
618,619,These kind of errors are extremely difficult to figure out on stackoverflow and github,try,2017-01-06 02:18:44,bherila,test_Typescript,0,0,1,0,,[87]
619,620,npm is the preferred way to get typings,look good seem solve issue run test across multiple different devices goal actually speed test execution parallelize execution test suite across multiple appium servers,2017-01-06 02:18:49,dtabuenc,test_Typescript,0,0,1,1,,"[87, 88]"
620,621,--traceResolutionis a great tool in tsc,jbehave test use appium take near hours complete much btw look reasonable guy appium test hours,2017-01-06 02:19:04,dtabuenc,test_Typescript,0,0,1,1,a use,"[87, 88]"
621,622,to figure out where typescript is looking for modules,file appium support issue ios upgrade xcuitestdriver test runtime double,2017-01-06 02:19:12,dtabuenc,test_Typescript,0,0,1,1,a file,"[87, 88]"
622,623,if you getTS2307errors,around test take almost hours ios test hoursaligns along line,2017-01-06 02:19:33,dtabuenc,test_Typescript,0,0,1,1,"a s, a take","[87, 88]"
623,624,ahh that is useful,android much faster though,2017-01-06 02:24:56,bherila,test_Typescript,0,0,1,1,,"[87, 88]"
624,625,[<-CODE->] it is looking inside node_modules but notnode_modules/@types/,earlier android use hella slow,2017-01-06 02:31:46,bherila,test_Typescript,0,0,1,1,a s,"[87, 88]"
625,626,I found: [<-ISSUE->],dont know solution ios multiple machine limitation guess,2017-01-06 02:34:48,bherila,test_Typescript,0,0,1,1,,"[87, 88]"
626,627,"but I am using ""node"" module resolution",hardikd input,2017-01-06 02:34:56,bherila,test_Typescript,0,0,1,1,,"[87, 88]"
627,628,^ that was fixed by upgrading totypescript@2.0,,2017-01-06 02:50:18,bherila,test_Typescript,0,0,1,0,,[87]
628,629,ahh yeah@types/was introduced in 2.0+,add,2017-01-06 02:50:56,dtabuenc,test_Typescript,0,0,1,0,,[87]
629,630,so maybe your friend was on 2.0 and that's why he was getting all those conflicting duplicate definitions,hello allim trouble try scale appium test interest hear people run multiple appium servers run test initial idea run appium docker cloud machine android didnt work since able run arm cloud slow need ios didnt come anything handle multiple machinesdevices pay solution like anyone solve another way share,2017-01-06 02:51:09,dtabuenc,test_Typescript,0,0,1,0,"a like, a me",[87]
630,631,that makes sense!,try,2017-01-06 02:55:43,bherila,test_Typescript,0,0,1,0,,[87]
631,632,Hi Guys.,look good seem solve issue run test across multiple different devices goal actually speed test execution parallelize execution test suite across multiple appium servers,2017-01-09 15:35:29,asolopovas,test_Typescript,0,0,0,0,,[88]
632,633,Has anyone tried building Vue.plugin using typescript class?,jbehave test use appium take near hours complete much btw look reasonable guy appium test hours,2017-01-09 15:35:58,asolopovas,test_Typescript,0,0,1,0,a use,[88]
633,634,I am trying to get install method triggered but having no luck in doing that. If someone tried please let me know,file appium support issue ios upgrade xcuitestdriver test runtime double,2017-01-09 15:37:43,asolopovas,test_Typescript,0,0,1,0,a file,[88]
634,635,That link would be a lot shorter if they used Unix style line endings,around test take almost hours ios test hoursaligns along line,2017-01-09 18:42:21,sharwell,test_Typescript,0,0,0,1,"a s, a take",[89]
635,636,"(not something that's configurable, just something I noticed and found interesting)",android much faster though,2017-01-09 18:43:24,sharwell,test_Typescript,0,0,1,1,,[89]
636,637,More curious: [<-LINK->],earlier android use hella slow,2017-01-09 18:47:52,sharwell,test_Typescript,0,0,1,1,a s,[89]
637,638,Or this one,dont know solution ios multiple machine limitation guess,2017-01-09 18:49:55,sharwell,test_Typescript,0,0,1,1,,[89]
638,639,[<-LINK->],hardikd input,2017-01-09 18:49:57,sharwell,test_Typescript,0,0,1,0,,[89]
639,640,"Hi, I am a beginner to typescript, and have some simple question. If I have some js library file, then how can I use it in a ts file?",,2017-01-10 09:59:41,rajdeep26,test_Typescript,0,0,0,0,,[90]
640,641,rajdeep26: [<-LINK->],add,2017-01-10 10:00:32,HendrikRoth,test_Typescript,1,0,0,0,,[90]
641,642,Thanks@HendrikRoth. I'll go through it,hello everyone new appium like know limitations issue automate ios app make swift,2017-01-10 10:01:42,rajdeep26,test_Typescript,1,0,0,0,"a issue, a new, a s",[90]
642,643,"rajdeep26: /// <reference path=""pathtofile.ts"" />",try get appium software appium doctor give follow appiumdoctor diagnostic start info appiumdoctor xcode instal applications detect mac version swvers output,2017-01-10 10:02:14,HendrikRoth,test_Typescript,1,0,0,0,"a are, a get, code in",[90]
643,644,Can you give some example?,appium version ara,2017-01-10 10:04:09,rajdeep26,test_Typescript,0,0,1,0,"a on, a version",[90]
644,645,Lets say i have a simple js file which has only 1 function like this: [<-CODE->] How can i use this function in a ts file?,xcode version use,2017-01-10 10:06:15,rajdeep26,test_Typescript,0,0,1,0,,"[90, 91]"
645,646,does the library have typescript definitions?,,2017-01-10 10:06:59,echeese,test_Typescript,0,0,0,0,,[]
646,647,[<-CODE->],need use appium,2017-01-10 10:07:40,HendrikRoth,test_Typescript,0,0,1,0,a use,[90]
647,648,Not sure if it works but have you triedimport './that_file.js';?,,2017-01-10 10:09:21,con-ssc,test_Typescript,0,0,0,1,,[91]
648,649,actually we want to start using typescript for one of our project and were wondering that there will be many a times where we might come across a library which doesnt have any type deifinitions and its just a normal js file. So how should we proceed in this scenario?,dont see appium bitbucket account,2017-01-10 10:09:34,rajdeep26,test_Typescript,0,0,1,0,dont see,[91]
649,650,Usually it is hard to import anything that doesn't has an export,appium install via terminal desktop app still,2017-01-10 10:09:49,con-ssc,test_Typescript,0,0,1,1,,[91]
650,651,So how to use such files?,theres dmg appium something guy work,2017-01-10 10:10:04,rajdeep26,test_Typescript,0,0,1,0,,[91]
651,652,"well, mayberequireworks here",,2017-01-10 10:10:26,con-ssc,test_Typescript,0,0,1,1,,[91]
652,653,rajdeep26: i would suggest you to use d.ts files,install via command line,2017-01-10 10:10:33,HendrikRoth,test_Typescript,1,0,0,0,,[91]
653,654,"better for ""porting"" an existing project",,2017-01-10 10:10:49,HendrikRoth,test_Typescript,0,0,1,0,,[91]
654,655,what if the d.ts file doesnt exist for some 3rd party library? I wil have to create a d.ts for it inorder to use it?,cbiermannimvu appium support sierra,2017-01-10 10:11:30,rajdeep26,test_Typescript,0,0,1,0,,[91]
655,656,yes create a dummy d.ts file,sierra,2017-01-10 10:11:47,HendrikRoth,test_Typescript,0,0,1,0,,[91]
656,657,dummy?,downgrade mac,2017-01-10 10:12:08,rajdeep26,test_Typescript,0,0,1,0,,[91]
657,658,what do you mean by dummy d.ts file?,appium work sierra,2017-01-10 10:12:18,rajdeep26,test_Typescript,0,0,1,0,,[91]
658,659,creating an empty d.ts works?,think hardik say appium doesnt work sierra,2017-01-10 10:12:51,rajdeep26,test_Typescript,0,0,1,0,,[91]
659,660,rajdeep26: do you have a specific 3rd party lib you want to use?,wont work xcode apple remove old instrumentation drive shouldnt work want use appium roll back mac roll back older version xcode xcode pre wont able test ios,2017-01-10 10:12:55,con-ssc,test_Typescript,1,0,0,1,a use,[91]
660,661,rajdeep26: name the library pls,get,2017-01-10 10:13:32,am0nshi,test_Typescript,1,0,0,0,,[91]
661,662,coz even peerJS which i plan to use have dts files,edgeman see folks complain work sierra,2017-01-10 10:13:45,am0nshi,test_Typescript,0,0,1,0,,[91]
662,663,How about this? [<-LINK->],hence hesitant upgrade,2017-01-10 10:15:09,rajdeep26,test_Typescript,0,0,1,0,,"[91, 92]"
663,664,BTW I just wanted to know this before we jump into using typescript,upgrade cap sierra brand new machine,2017-01-10 10:15:40,rajdeep26,test_Typescript,0,0,1,0,,"[91, 93]"
664,665,You could create a definition that sets the root class or whatever as :any,guy possible automate application write swift use appium ive tell appium interact objective apps,2017-01-10 10:16:58,echeese,test_Typescript,0,0,0,0,a use,[94]
665,666,"you won't get type safety, obviously",automate swift apps sure swift specific,2017-01-10 10:18:03,echeese,test_Typescript,0,0,1,0,,[94]
666,667,thats fine,aniket thank answer,2017-01-10 10:18:21,rajdeep26,test_Typescript,0,0,1,0,,"[92, 93]"
667,668,For some things we are willing to ignore the type checks for now,think doesnt matter language use write app either way appium require anythin implement app automation work unlike frameworks,2017-01-10 10:18:44,rajdeep26,test_Typescript,0,0,1,0,"a implement, a way, a write, app either, on work","[92, 93]"
668,669,in that case you'd probably want something likedeclare var CitrusPay: any,appium use apple test framework xcuitest,2017-01-10 10:19:50,echeese,test_Typescript,0,0,1,0,a use,[94]
669,670,echeese: Thanks. Understood,ratkod possible run test ios compatibel xcode,2017-01-10 10:20:22,rajdeep26,test_Typescript,1,0,0,1,,"[92, 93, 94, 95]"
670,671,BTW how do i use it in my code after creating d.ts file?,mkulava indeed capability automationname xcuitest,2017-01-10 10:21:00,rajdeep26,test_Typescript,0,0,1,1,a in,"[92, 93, 94, 95]"
671,672,Cant import anything from it,hazmeister great news thank,2017-01-10 10:21:08,rajdeep26,test_Typescript,0,0,1,1,,"[92, 93, 94, 95]"
672,673,I think i understood what I need to do. Just referred this d.ts file for jquery [<-LINK->],yes confirm complicate setup,2017-01-10 10:31:04,rajdeep26,test_Typescript,0,0,1,1,,"[92, 93, 94, 95]"
673,674,Thanks guys,complicate,2017-01-10 10:31:10,rajdeep26,test_Typescript,0,0,1,0,,"[92, 93, 94]"
674,675,would it be possibe withtscto get the AST output of a javascript file? And would it be possible to generate a simple d.ts from that AST ?,,2017-01-10 10:40:56,con-ssc,test_Typescript,0,0,0,0,,[]
675,676,"I am using the following TSConfig; [<-CODE->] In my .ts files, where ever I have a comment on the last line, the JS output is broken. E.g. [<-CODE->] Is this a known TS bug?",anyone update new itunes suspicion break appium ability talk safari real devices,2017-01-10 11:51:57,itsphil,test_Typescript,0,0,0,1,break on,[95]
676,677,"[<-CODE->] does resolve it, but doesn't seem right that it should break on false.",havent knock door,2017-01-10 11:53:46,itsphil,test_Typescript,0,0,1,1,,[95]
677,678,TS file in question [<-CODE->],guy anyone know solution many instance service already run error,2017-01-10 11:54:25,itsphil,test_Typescript,0,0,1,1,"any in, anyone know, m on",[95]
678,679,Version 2.1.4,happen time even test need reboot test device,2017-01-10 11:57:37,itsphil,test_Typescript,0,0,1,1,,[95]
679,680,[<-CODE->] What is the type of _cachedRights?,pain ass time,2017-01-10 17:32:08,TheeRFG,test_Typescript,0,0,0,0,a in,[95]
680,681,My json is [<-CODE->],nobody use appium actually unusable bug things work,2017-01-10 17:34:36,TheeRFG,test_Typescript,0,0,1,0,a use,[95]
681,682,so I thought it would be _cachedRights: boolean[]But perhaps this is not the case?,trouble appium xcode ios instal new ios driver xcuitest try get test run ipad air simulator really ios simulator simulator pop new webdriveragent appear start app launch try close immediately ive try almost everything sort loss post detail momentarily build app appium log anyone help though appreciate,2017-01-10 17:34:51,TheeRFG,test_Typescript,0,0,1,0,a build,[95]
682,683,types is weird,icanlaunch app simulator within xcode strange wonder conflict incorrect setup new automation drivers,2017-01-10 18:37:51,dtabuenc,test_Typescript,0,0,0,1,a new,[96]
683,684,why do you do that?,capitan,2017-01-10 18:37:54,dtabuenc,test_Typescript,0,0,1,1,,[96]
684,685,What'stypes/*??,capitan,2017-01-10 18:38:09,dtabuenc,test_Typescript,0,0,1,1,,[96]
685,686,you should link to a specific d.ts file,mmcintyre log help try assist ready,2017-01-10 18:39:21,dtabuenc,test_Typescript,0,0,1,1,,[96]
686,687,it should be probably pointing totypes/index.d.ts,,2017-01-10 18:39:55,dtabuenc,test_Typescript,0,0,1,0,,[96]
687,688,if you have one,thx,2017-01-10 18:40:06,dtabuenc,test_Typescript,0,0,1,0,,[96]
688,689,basically types should point to the d.ts file of what main is pointing to,give one min,2017-01-10 18:40:28,dtabuenc,test_Typescript,0,0,1,0,,[96]
689,690,scippio: it's better if you don't keep a seaparate types/ folder,edgeman,2017-01-10 18:45:04,dtabuenc,test_Typescript,0,0,1,0,,[96]
690,691,and just output d.ts files side-by-side,send log avoid clutter channel share solution get work,2017-01-10 18:45:11,dtabuenc,test_Typescript,0,0,1,0,,[96]
691,692,so there are both alib/index.jsand alib/lindex.d.tsalong side it,mmcintyre,2017-01-10 18:45:38,dtabuenc,test_Typescript,0,0,1,0,,[96]
692,693,"then you don't really even need the""types"":field in your package.json",see help,2017-01-10 18:45:56,dtabuenc,test_Typescript,0,0,1,0,,[96]
693,694,"Hi, I wanted to use TS'sHarnessAPIs to better verify the correctness of my typings forramda.js, but had trouble importing them since it doesn't export its namespace. Has anyone used these before?",,2017-01-12 06:32:45,tycho01,test_Typescript,0,0,0,0,,[97]
694,695,"(hi@ShadowManu:D, please consider pulling my tests/documentation to your pug pr! :P)",case sleep help,2017-01-12 06:34:18,tycho01,test_Typescript,0,0,1,0,,[97]
695,696,"never heard of harness, what is that?",anyone know step take launch website safari ios devices download safari extension,2017-01-12 08:07:21,con-ssc,test_Typescript,0,0,0,0,anyone know,[98]
696,697,TypeScript uses it to test compilation output for different use-cases to prevent regressions.,package demosimport class test,2017-01-12 08:08:50,tycho01,test_Typescript,0,0,1,0,,[97]
697,698,"domoritz: My guess forts.TypeFlags.Anonymousthat now onlyts.ObjectFlags.Anonymousis possible, but I'm only guessing",test native ios app web application ios,2017-01-12 08:11:17,con-ssc,test_Typescript,0,0,1,1,a s,"[98, 99]"
698,699,ts.NodeFlags.Abstractseems to be only available asts.ModifierFlags.Abstract,doesnt seem work,2017-01-12 08:13:13,con-ssc,test_Typescript,0,0,1,1,,"[98, 99]"
699,700,Since I have no Idea what your ts to json compiler does it is hard to help you out :),web app,2017-01-12 08:13:38,con-ssc,test_Typescript,0,0,1,1,,"[98, 99]"
700,701,tuple is also now in object,,2017-01-12 08:14:42,con-ssc,test_Typescript,0,0,1,1,,"[98, 99]"
701,702,and reference also,work appium ios version,2017-01-12 08:14:56,con-ssc,test_Typescript,0,0,1,0,,[98]
702,703,just a reminder@domoritzadd more documentation to your lib code ;),webdriver driver new safaridriver,2017-01-12 08:17:24,con-ssc,test_Typescript,0,0,1,0,,[98]
703,704,"con-ssc: : json-schema does... schemas for json. his lib would allow reusing TS's compile-time sanity checks during run-time (i.e. on JSON data coming in over the wire), which is pretty cool. :)",still input script,2017-01-12 10:05:43,tycho01,test_Typescript,1,0,0,0,,[98]
704,705,"@scippio bluebird? why not stick with vanilla promises?@jacobus-brogly I love some functions like mapSeries, all .... etc. ... I copy d.ts file and import ""bluebird"" as Promise ...",example link post,2017-01-12 12:46:41,scippio,test_Typescript,0,0,0,0,,[]
705,706,"Hello guys, could you suggest some typescript tutorial, fresh one, where I can learn ts deep :) Tutorial at site doesn't deep enough. The best would be example transferring to ts.",real device input udid change ios version,2017-01-12 13:39:44,CubaSAN,test_Typescript,0,0,0,0,,[99]
706,707,CubaSAN: [<-LINK->],code yes theres setup process different instructions list link provide read everything need know,2017-01-12 13:46:31,con-ssc,test_Typescript,1,0,0,0,,"[98, 99]"
707,708,Anyone know how to extend map so as to provide your own strong typed version,anyone issue latest intelij javatestngcucumber keep get test find clean project setup,2017-01-14 02:14:32,SamD,test_Typescript,0,0,0,0,i one,[100]
708,709,HeyI have the following type and i'm looking for a more elegant way to declare it (an interface maube) [<-CODE->],create new local repo recloned opeend intelij work,2017-01-14 02:14:39,Bnaya,test_Typescript,0,0,0,0,,[101]
709,710,"SamD: Map is a generic, so you can do: [<-CODE->]",try,2017-01-14 02:15:36,Bnaya,test_Typescript,0,0,1,0,,"[100, 101]"
710,711,That's not a type though,tryin run appium device,2017-01-14 02:15:56,SamD,test_Typescript,0,0,1,1,,"[100, 101]"
711,712,I want to define my own type for usage throughout,different,2017-01-14 02:16:20,SamD,test_Typescript,0,0,1,1,,"[100, 101]"
712,713,"type myMap = Map<string, number>; ?",think must ssign specific usb per container,2017-01-14 02:16:44,Bnaya,test_Typescript,0,0,1,0,,"[100, 101]"
713,714,"So interface x implements Map<string, sometype> for example",container doesnt grab,2017-01-14 02:17:45,SamD,test_Typescript,0,0,1,1,,"[100, 101]"
714,715,Oh u don't need to extend/implement ?,docker image use,2017-01-14 02:18:16,SamD,test_Typescript,0,0,1,1,,"[100, 101]"
715,716,what is your usecase?,didnt find name appiumbaseproject,2017-01-14 02:18:39,Bnaya,test_Typescript,0,0,1,0,a me,"[100, 101]"
716,717,"OK I'm a bit new to type script, I'll try it out thanks",get,2017-01-14 02:18:55,SamD,test_Typescript,0,0,1,1,,"[100, 101]"
717,718,[<-CODE->],start instance,2017-01-14 02:19:46,Bnaya,test_Typescript,0,0,1,0,,[100]
718,719,I want to define a type such as that which can be used a parameter across various methods so I want the types to the map to be specific,,2017-01-14 02:19:50,SamD,test_Typescript,0,0,1,0,,[100]
719,720,I had an error when I tried that,hello every one one help issue,2017-01-14 02:20:11,SamD,test_Typescript,0,0,1,0,every on,[100]
720,721,U can't extend,android application crash moment run testng use appium,2017-01-14 02:20:19,SamD,test_Typescript,0,0,1,0,a use,[100]
721,722,js error or type check error?,hello send login password write password field,2017-01-14 02:20:48,Bnaya,test_Typescript,0,0,1,0,,[100]
722,723,"Can't remember the exact error, was giving me a problem creating a new instance",,2017-01-14 02:21:07,SamD,test_Typescript,0,0,1,1,,"[100, 102]"
723,724,Type,,2017-01-14 02:21:14,SamD,test_Typescript,0,0,1,1,,"[100, 102]"
724,725,I figured it would have been simple like you were sayimg,selenium conference early bird ticket sale,2017-01-14 02:22:01,SamD,test_Typescript,0,0,1,1,,"[100, 102]"
725,726,But whatever I tried cmae up with an error,anyone know reason maven build failure initialize,2017-01-14 02:22:21,SamD,test_Typescript,0,0,1,1,"anyone know, m on","[100, 102]"
726,727,Came,declare appiumdriver driver,2017-01-14 02:22:25,SamD,test_Typescript,0,0,1,0,"a are, a declare",[100]
727,728,"Oh actually I didn't define the type first like your example, I'll try that thanks",anyone familiar selenium grid,2017-01-14 02:23:17,SamD,test_Typescript,0,0,1,0,,[100]
728,729,Oh that is not related to the interface so nevermind,whats,2017-01-14 02:23:57,SamD,test_Typescript,0,0,1,0,,[100]
729,730,[<-LINK->],selenium grid plugin instal jenkins machine unix nod machine unix machine windows start node machine unix start node machine windows something happen even acces urlgridconsole,2017-01-14 02:25:17,Bnaya,test_Typescript,0,0,1,0,i plugin,[100]
730,731,Thanks I'll take a look when I get back to my comp on my phone now,log see grid server machine start windows node machine,2017-01-14 02:27:05,SamD,test_Typescript,0,0,1,0,,[100]
731,732,Issymbol.getJsDocTags()supposed to also returnJSDocTypeTag?,channel stop,2017-01-15 05:23:57,domoritz,test_Typescript,0,0,0,0,,[102]
732,733,con-ssc: What schema does ms flow use?,node log,2017-01-15 05:25:41,domoritz,test_Typescript,0,0,1,0,,[102]
733,734,"I fear I may be writing the following signature wrong (return a stream of functions f: TaskListAction -> boolean):makeReducer$(action$: Stream<TaskListAction>): Stream<(TaskListAction) => boolean>, since I get there errorParameter 'TaskListAction' implicitly has an 'any' typefor the line where the function declaration is.",dont understand windows machine cause thisall machine vpn,2017-01-15 13:52:30,bbarker,test_Typescript,0,0,0,1,"and window, this use",[103]
734,735,"My IDE (IntelliJ) doesn't complain, and it usually seems to catch type errors",info start auto registration thread try register every info register node hub info node register hub ready use,2017-01-15 13:53:02,bbarker,test_Typescript,0,0,1,1,,[103]
735,736,"Also, if I shouldn't be asking basic questions in this channel, please feel free to direct be elsewhere",linux node windows node,2017-01-15 13:54:23,bbarker,test_Typescript,0,0,1,1,,[103]
736,737,"oh weird (to me), looks like I have to specify a dummy parameter name, 'tla' in this case:Stream<(tla: TaskListAction) => boolean>",windows node,2017-01-15 14:01:47,bbarker,test_Typescript,0,0,1,1,,[103]
737,738,anyone know why destructuring an array,linux node connect register hubits everything goodthe windows node give headache,2017-01-16 02:13:23,stevekane,test_Typescript,0,0,0,1,,[103]
738,739,always seems to ruin type inference,info node register hub ready use info stop acceptor serversocketaddr,2017-01-16 02:13:28,stevekane,test_Typescript,0,0,1,1,i use,[103]
739,740,?,statements gap min,2017-01-16 02:13:29,stevekane,test_Typescript,0,0,1,1,,[103]
740,741,"if I use const [ x, ...xs ] = myArray",arent anything node connect,2017-01-16 02:13:38,stevekane,test_Typescript,0,0,1,1,,[103]
741,742,I then always have to tell the typechecker about types that it should be able to infer,nope,2017-01-16 02:13:51,stevekane,test_Typescript,0,0,1,0,,[103]
742,743,but if I just change my code to the non-sugared version it's all god,hit start jenkins thats,2017-01-16 02:14:03,stevekane,test_Typescript,0,0,1,0,,[103]
743,744,const x = myArray[0],mean,2017-01-16 02:14:07,stevekane,test_Typescript,0,0,1,0,,[103]
744,745,const xs = myArray.slice(1),run test node,2017-01-16 02:14:18,stevekane,test_Typescript,0,0,1,0,,[103]
745,746,domoritz: [<-LINK->],nope,2017-01-16 09:08:38,con-ssc,test_Typescript,0,0,0,0,,[104]
746,747,"I have exactly defined type in dependicies because I don't want something broke... for example:""@types/restify"": ""2.0.36""... but something broke so I muset change the version to:""@types/restify"": ""2.0.37"",... why?!! It's constantly brake my systems everytime I run npm install :(",want establish connection,2017-01-16 09:24:01,scippio,test_Typescript,0,0,0,0,,[]
747,748,what about using^2.0.36or something instead?,defaultremoteproxy unknown version grindconsole,2017-01-16 09:34:24,con-ssc,test_Typescript,0,0,1,1,,"[104, 105]"
748,749,using exact versions may not be a good idea,log look node,2017-01-16 09:34:58,con-ssc,test_Typescript,0,0,1,1,,"[104, 105]"
749,750,or~2.0,paste node log,2017-01-16 09:36:14,con-ssc,test_Typescript,0,0,1,1,,"[104, 105]"
750,751,just have a look at [<-LINK->],hello guy anybody work zephyr automation write appium script java android studio want trigger jira via zephyr plugin help,2017-01-16 09:36:26,con-ssc,test_Typescript,0,0,1,1,"a and, a via, a write","[104, 105]"
751,752,hi folks,try scroll page android application use method work way,2017-01-19 21:09:07,jacobus-brogly,test_Typescript,0,0,0,1,,[105]
752,753,i have a question,public void scrollpageup javascriptexecutor javascriptexecutor driverhashmap swipeobject new hashmap swipe swipeobject,2017-01-19 21:09:13,jacobus-brogly,test_Typescript,0,0,1,1,,[105]
753,754,[<-CODE->],error log yet implement please help warn server provide stacktrace information,2017-01-19 21:09:17,jacobus-brogly,test_Typescript,0,0,1,1,,[105]
754,755,"what type should dispatch have, I dont want to give ""any""",mobile swipe valid implementation,2017-01-19 21:09:31,jacobus-brogly,test_Typescript,0,0,1,1,,[105]
755,756,(react-redux),support action remove long back,2017-01-19 21:09:40,jacobus-brogly,test_Typescript,0,0,1,0,,[105]
756,757,Dispatch is defined like so [<-CODE->],use execute script swipe,2017-01-19 21:10:39,jacobus-brogly,test_Typescript,0,0,1,0,,[105]
757,758,[<-CODE->],aniket please tell method use,2017-01-19 21:11:38,jacobus-brogly,test_Typescript,0,0,1,0,me tell,[105]
758,759,"S from Dispatch<S> is not used, note, this is the orignal ""type"" file of ""react-redux""",,2017-01-19 21:13:09,jacobus-brogly,test_Typescript,0,0,1,0,,[105]
759,760,ok I see its related to this issue [<-ISSUE->],thank let,2017-01-19 21:22:11,jacobus-brogly,test_Typescript,0,0,1,0,,[105]
760,761,"its a ""fix"" on Dispatch",method call page scroll,2017-01-19 21:22:39,jacobus-brogly,test_Typescript,0,0,1,0,,[105]
761,762,[<-CODE->] [<-CODE->] Types have separate declarations of a private propertyWhat am I doing...,swipeelementdirection one,2017-01-19 22:54:47,TheeRFG,test_Typescript,0,0,0,0,,[]
762,763,you are definining _changeDetector twice,swipeelementdirection class name,2017-01-19 22:55:52,dtabuenc,test_Typescript,0,0,0,0,,[106]
763,764,"Hi, what do I need to do to get my typescript module which is hosted on my private github group to be used as a module dependancy for other projects from other users in my group? I read that I should not put my .d.ts or my .js files in github, but they should be in my module and the .ts files should not be in the module but should be in my github. Publishing the module privately isn't an option sadly.",swipe line,2017-01-20 12:37:58,avik-so,test_Typescript,0,0,0,0,,[107]
764,765,avik-so: and option you can consider (I'm not sure if the best one) is using git submodules and your users have relative imports to your submodule location.,yes,2017-01-20 13:32:56,ShadowManu,test_Typescript,1,0,0,0,,[107]
765,766,would you say this router is looking like a framework? or can I still get away with calling it vanilla?,leave right swipe,2017-01-25 10:42:41,quantuminformation,test_Typescript,0,0,0,0,,[108]
