,id,text,clean,sent,username,chatroom,mention,ngrams,involved,back_and_forth,bigrams,discussionId
325,326,So the thinking is if you are setting extra properties you'll never be able to safely access them from the interface that you are assigning,yes,2016-12-13 16:02:49,dtabuenc,test_Typescript,0,0,1,0,,[57]
326,327,so the compiler assumes this is likely an error on your part,scrollto remove javaclient,2016-12-13 16:02:58,dtabuenc,test_Typescript,0,0,1,0,,[57]
327,328,and you have to use type assertion to get around it,jar,2016-12-13 16:03:08,dtabuenc,test_Typescript,0,0,1,0,,[57]
328,329,"Why would this not apply to test4 then? This is basically the same example as test3, only that in this case, a Promise of the type ITest is returned",,2016-12-13 16:08:43,Z3roCoder,test_Typescript,0,0,1,0,,[57]
329,330,probably an edgecase the compiler does not consider,,2016-12-13 16:09:40,dtabuenc,test_Typescript,0,0,1,0,,[57]
330,331,"Alright, i will write a issue about this then",,2016-12-13 16:09:53,Z3roCoder,test_Typescript,0,0,1,0,,[57]
331,332,Maybe then it will become clearer,otherway scroll idea,2016-12-13 16:10:01,Z3roCoder,test_Typescript,0,0,1,0,,[57]
332,333,is there any Di/ioc framework (for node.js) currenly widely accepted by typescript community? or is there some method/function in typescript so itâ€™s not needed? couldnt really find anything except the angular one,,2016-12-13 21:24:24,scarlier,test_Typescript,0,0,0,1,,[57]
333,334,[<-LINK->],even,2016-12-13 21:25:14,dtabuenc,test_Typescript,0,0,1,0,,[57]
334,335,haven't used it but I know that some people have used that,,2016-12-13 21:25:25,dtabuenc,test_Typescript,0,0,1,0,,[57]
335,336,would think it's similar to the angular 2 one,,2016-12-13 21:25:31,dtabuenc,test_Typescript,0,0,1,0,,[57]
336,337,thanks going to check it out,fro scroll,2016-12-13 21:25:51,scarlier,test_Typescript,0,0,1,1,,"[57, 58]"
337,338,"thre are probably others, although I wouldn't classify any as having ""wide acceptance"" in the community",,2016-12-13 21:26:01,dtabuenc,test_Typescript,0,0,1,0,,[57]
338,339,angular 2 and aurelia have wide acceptance within their respective communities,,2016-12-13 21:26:27,dtabuenc,test_Typescript,0,0,1,0,,[57]
339,340,but probably very few people using them outside as standalone DI,enter,2016-12-13 21:26:45,dtabuenc,test_Typescript,0,0,1,0,,[57]
340,341,scarlier: try there's one that's SUPER heavy handed calledinversify,swipe,2016-12-13 21:27:10,varunjayaraman,test_Typescript,1,0,0,0,,"[58, 59]"
341,342,i prefer this one calledtypedithat i prefer since its API is super simple,yes,2016-12-13 21:27:26,varunjayaraman,test_Typescript,0,0,1,0,,"[58, 60]"
342,343,varunjayaraman: ty inversify looks promesing,,2016-12-13 21:28:58,scarlier,test_Typescript,1,0,0,1,,"[57, 59, 60]"
343,344,varunjayaraman: what qualifies as SUPER heavy handed,instead scroll usig swipe,2016-12-13 21:29:33,dtabuenc,test_Typescript,1,0,0,0,,"[57, 59, 60]"
344,345,?,swipe option available,2016-12-13 21:29:34,dtabuenc,test_Typescript,0,0,1,0,a on,"[57, 59, 60]"
345,346,varunjayaraman: any experience with the performance of it?,hmmm,2016-12-13 21:30:00,scarlier,test_Typescript,0,0,1,0,,"[57, 59, 60]"
346,347,dtabuenc: just felt like it was overly complicated to get it to work,know beter scroll option latest appium please suggest,2016-12-13 21:30:48,varunjayaraman,test_Typescript,1,0,0,0,latest on,"[57, 59, 60]"
347,348,scarlier: I don't think performance is going to vary much between frameworks,,2016-12-13 21:31:20,dtabuenc,test_Typescript,1,0,0,0,,"[57, 59, 60]"
348,349,scarlier: i doubt it,mgmanikandan thank work,2016-12-13 21:31:24,varunjayaraman,test_Typescript,0,0,1,0,,"[57, 59, 60]"
349,350,they all essentially register dependencies in some kind of lookup table,cool,2016-12-13 21:31:29,dtabuenc,test_Typescript,0,0,1,1,,"[57, 59, 60, 61]"
350,351,and pull from there on instantiation,xcuielementtypeotherxcuielementtypeother,2016-12-13 21:31:33,dtabuenc,test_Typescript,0,0,1,1,,"[57, 59, 60, 61]"
351,352,so performance wise they will all be similar,even work,2016-12-13 21:31:41,dtabuenc,test_Typescript,0,0,1,1,,"[57, 59, 60, 61]"
352,353,unless they are doing something really stupid,try,2016-12-13 21:31:46,dtabuenc,test_Typescript,0,0,1,1,,"[57, 59, 60, 61]"
353,354,"all i needed was something that registers, gets, and can invoke functions with injected dependencies",mobileelement abmobileelement,2016-12-13 21:32:00,varunjayaraman,test_Typescript,0,0,1,0,,"[57, 59, 60]"
354,355,ah ok,shabinmohan work little bite try,2016-12-13 21:33:14,scarlier,test_Typescript,0,0,1,0,,"[57, 59, 60]"
355,356,Does anyone have idea on why this code does not compile undernoImplicitAny?,prabudakshan sure let try one thank,2016-12-14 04:43:43,HerringtonDarkholme,test_Typescript,0,0,0,0,,[61]
356,357,[<-CODE->],,2016-12-14 04:43:56,HerringtonDarkholme,test_Typescript,0,0,1,0,,[61]
357,358,how would it know the type of s?,use deprecate java,2016-12-14 05:15:17,dtabuenc,test_Typescript,0,0,1,1,,"[60, 61]"
358,359,dtabuenc: noteStrs<T>has an index signature,use touchaction class,2016-12-14 05:17:17,HerringtonDarkholme,test_Typescript,1,0,0,0,to use,"[60, 61]"
359,360,"if I delete the first overload ofmutations, it compiles",tfcardoso swipe,2016-12-14 05:17:38,HerringtonDarkholme,test_Typescript,0,0,1,0,,"[60, 61]"
360,361,I think the type algebra might be too much for the inference engine and you just have to specify it,,2016-12-14 05:20:20,dtabuenc,test_Typescript,0,0,1,1,,"[60, 61]"
361,362,"This is a reduced example, in real world code the first argument is too complex to get manual annotation",yes presswaitactionmovetoreleaseperform,2016-12-14 05:20:57,HerringtonDarkholme,test_Typescript,0,0,1,0,,"[60, 61]"
362,363,"I guess there is some problem in overloading resolution and contextual inference, but cannot debugging further deeper.",still didnt adapt code change swipe tap zoom pinch etc,2016-12-14 05:26:55,HerringtonDarkholme,test_Typescript,0,0,1,0,,"[60, 61]"
363,364,Probably this is a related issue to [<-ISSUE->],set webdriverwait timeout give exception,2016-12-14 05:34:34,HerringtonDarkholme,test_Typescript,0,0,1,0,it t,"[60, 61]"
364,365,Yeah it looks like that would be it. It's not clear that they are fixing that anytime soon though.,,2016-12-14 06:42:34,dtabuenc,test_Typescript,0,0,1,1,,"[60, 61]"
365,366,Will TypeScript interact with C++? Or even embed TypeScript/JavaScript API to C++?,anyone know turn wifi ios android use appium mocha javascript,2016-12-14 14:52:35,acterhd,test_Typescript,0,0,0,0,"a javascript, a s, a use, anyone know",[62]
366,367,"acterhd: there are some things out there, like nibind, and asm.js that can compile c++ to js/ts or you can embed chrome v8 engine in c++ and run compiled typescript code.",anyone use python nosetests framework,2016-12-14 16:18:14,dtabuenc,test_Typescript,1,0,0,0,,"[61, 62]"
367,368,"for my app, I want to use repsonse mailing to validate signup",take cmap mobile app test automation certification,2016-12-14 19:52:13,jacobus-brogly,test_Typescript,0,0,0,0,,[63]
368,369,any good solutions for this (preferably something i can try for free),anyone know appium work android emulator work prior,2016-12-14 19:52:25,jacobus-brogly,test_Typescript,0,0,1,0,anyone know,[63]
369,370,it's fine but don't distract this please,blueice app nnot launch,2016-12-16 21:44:59,stevekane,test_Typescript,0,0,0,0,,[64]
370,371,the point is why I THINK it's an anti-pattern,yes try firgure wrong,2016-12-16 21:45:08,stevekane,test_Typescript,0,0,1,0,,[64]
371,372,not that you cannot do it,work android device,2016-12-16 21:45:12,stevekane,test_Typescript,0,0,1,0,,[64]
372,373,"it's a conf dude, quiet till he finish",iam face issue locate xcuielementtypestatictext elementi try different atribute value relative xpath still able identify elementwhen print pagesourcei able see element xml filesame time inspect appiumiosinspector get xpath workingany face similer kind issue,2016-12-16 21:45:28,ghetolay,test_Typescript,0,0,0,0,"i try, in me, in time",[]
373,374,anyone got an example of a library that attaches an instance to window? I need to create typings for such a library and can't seem to get it to work,everyone appium work xcode need upgrade xcode,2016-12-19 12:40:14,intellix,test_Typescript,0,0,0,0,,[65]
374,375,Use interface augmentation,,2016-12-19 12:43:46,felixfbecker,test_Typescript,0,0,0,0,,[66]
375,376,[<-CODE->],awesome thank,2016-12-19 12:44:03,felixfbecker,test_Typescript,0,0,1,0,,[66]
376,377,you can also declare a global [<-CODE->],dont use automationname xcuitest,2016-12-19 12:44:23,felixfbecker,test_Typescript,0,0,1,0,a use,[66]
377,378,"hmmm, says X is not a module",cap,2016-12-19 12:45:04,intellix,test_Typescript,0,0,1,1,,"[65, 67]"
378,379,I have the import like: [<-CODE->],xcode,2016-12-19 12:45:26,intellix,test_Typescript,0,0,1,1,,"[65, 67]"
379,380,I guess I don't get the reference to thewindow.lpTagwith that?,yes,2016-12-19 12:45:41,intellix,test_Typescript,0,0,1,1,,"[65, 67]"
380,381,also with that I get:File '/node_modules/liveperson-chat-api/src/index.d.ts' is not a module.,awesome remember thank,2016-12-19 12:47:08,intellix,test_Typescript,0,0,1,1,,"[65, 67]"
381,382,I tried this: [<-CODE->] but then the lpTag is just an empty object and not the one that's attached to window,know check list start ios automation mainly inspect elements find nothing miss follow proper development standards name every element app,2016-12-19 12:47:40,intellix,test_Typescript,0,0,1,0,"a s, m on",[65]
382,383,not a fun experience :/ my TSC takes 7 seconds to compile so it takes me ages to try something that isn't going to work. trial and error,developers side,2016-12-19 12:49:42,intellix,test_Typescript,0,0,1,0,,[65]
383,384,"expected this to work, but nope :/ [<-CODE->]",,2016-12-19 12:53:08,intellix,test_Typescript,0,0,1,0,,[65]
384,385,"I've linked in the library that adds itself to window and am providing an index.d.ts, so that when I import it, then the script gets loaded.. but then how to get ahold of that window.lpTag reference -.-",use appium real ios device,2016-12-19 12:57:24,intellix,test_Typescript,0,0,1,0,a use,[65]
385,386,"with the declare var lpTag; when I console.log lpTag as I import it, it just seems to be an empty object. Not sure wtf that is meant to be",app launch twice appium session,2016-12-19 13:02:32,intellix,test_Typescript,0,0,1,0,,[65]
386,387,tsconfig paths - having an issue with using similar names. [<-CODE->] Issue 1: Can't make reference to @core within components core.Issue 2: Would have the word @core in both confuse the compiler?,expect behaviour call launch appium client,2016-12-20 08:53:16,itsphil,test_Typescript,0,0,0,0,,[]
387,388,hello! does anyone know where the version number for types pulled using@types/librarycan be found online? iâ€™m trying to figure out whether i have the most recent version of published types.,guy,2016-12-20 20:25:35,subvertallchris,test_Typescript,0,0,0,0,,[67]
388,389,well if you just npm install it will update to the latest,automation stepaupload image gallery facebook album,2016-12-20 20:26:02,dtabuenc,test_Typescript,0,0,0,0,,[68]
389,390,"thatâ€™s not what iâ€™m looking for, though",use mobile browser guy give idea,2016-12-20 20:26:11,subvertallchris,test_Typescript,0,0,1,0,,"[67, 69]"
390,391,"subvertallchris: there should be a package.json inside thenode_modules/@types/library directories that would have the version number in it, just like anything else from npm",,2016-12-20 20:26:33,coldacid,test_Typescript,1,0,0,1,,"[67, 69]"
391,392,I use npm update checker to check for updates and tell me what version of everything I have.,android device chrome browser,2016-12-20 20:26:59,dtabuenc,test_Typescript,0,0,1,0,,[68]
392,393,or are you referring to what version of the lib a particular npm package works with?,noboday know another question somehow exit text input field,2016-12-20 20:27:15,dtabuenc,test_Typescript,0,0,1,0,it t,[68]
393,394,"coldacid: i see that, but i am looking in the repo on github and package.json isnâ€™t there",mean exit text input field,2016-12-20 20:27:16,subvertallchris,test_Typescript,1,0,0,0,it t,[69]
394,395,pretty much every package in the@typesscope is magically generated,click different element exit,2016-12-20 20:27:53,coldacid,test_Typescript,0,0,1,1,,[69]
395,396,thereâ€™s a mistake in the types for Three.js,hiim use appium real ios deviceand app launch twice appium sessionis expect,2016-12-20 20:27:54,subvertallchris,test_Typescript,0,0,1,0,"a and, a use",[69]
396,397,scarlier: exactly,hardikd yes need guess element action,2016-12-20 20:27:55,con-ssc,test_Typescript,0,0,0,1,,[69]
397,398,and iâ€™m trying to figure out whether i should update first or if iâ€™m already on latest,need guess click logo picture something everything clickable,2016-12-20 20:28:06,subvertallchris,test_Typescript,0,0,1,0,,[69]
398,399,you have to actually go into the node_modules directory in your project,exactly want seem way,2016-12-20 20:28:07,coldacid,test_Typescript,0,0,1,1,,[69]
399,400,subvertallchris: just use npm view,yes usually enter text take action like submit button verify elements etc,2016-12-20 20:28:11,dtabuenc,test_Typescript,1,0,0,0,"a take, but it",[69]
400,401,to see all the versions available for a package,hope try hide keyboard,2016-12-20 20:28:18,dtabuenc,test_Typescript,0,0,1,0,,[69]
401,402,"ahh, thatâ€™s a big help! thanks.",problem need click twice,2016-12-20 20:28:41,subvertallchris,test_Typescript,0,0,1,0,,[69]
402,403,[<-LINK->],least text box focus,2016-12-20 20:28:55,dtabuenc,test_Typescript,0,0,1,0,,[69]
403,404,very cool,use appium react native experience difficulties get elements accessibility strategy seem testid etc behave differently ios android,2016-12-20 20:29:10,subvertallchris,test_Typescript,0,0,1,0,"a s, a ts, a use",[69]
404,405,"I use this though, to check all my dependencies and report what updates are available",appium suppose able run multiple android emulators concurrently assume use separate appium server instance,2016-12-20 20:29:11,dtabuenc,test_Typescript,0,0,1,0,,[69]
405,406,that is really helpful,whenever try appium seem handle example one server instance suppose handle one emulator telnets emulator something,2016-12-20 20:29:33,subvertallchris,test_Typescript,0,0,1,0,or something,[69]
406,407,"But in any case, if you WANT to be on the latest version and you are not sure...just runnpm install @types/libraryagain",maybe thats even try something emulators,2016-12-20 20:29:51,dtabuenc,test_Typescript,0,0,1,0,something try,[69]
407,408,that will always bring you up to the latest,despite use different server port bootstrap port chromedriver port even udid whether make difference,2016-12-20 20:30:04,dtabuenc,test_Typescript,0,0,1,0,,[69]
408,409,Vscode has a version lens plugin,actually even reliably run test two different emulators sequentially,2016-12-20 20:30:22,con-ssc,test_Typescript,0,0,0,1,,[69]
409,410,"iâ€™m on yarn, soyarn upgrade @types/whateveralso does it",sometimes work sometimes,2016-12-20 20:30:45,subvertallchris,test_Typescript,0,0,1,0,,[69]
410,411,Has yarn still the bug with not installing ex cutables,problems lead think appium mean support even read various place one anyway,2016-12-20 20:31:17,con-ssc,test_Typescript,0,0,1,1,,[69]
411,412,Did they fix yarn? I've had trouble with it dealing with@types/whateveror other sub-repo type stuff like@angular/core,use previously,2016-12-20 20:31:22,dtabuenc,test_Typescript,0,0,1,0,,[69]
412,413,like I would have to run it twice for it to work,havent try,2016-12-20 20:31:32,dtabuenc,test_Typescript,0,0,1,0,,[69]
413,414,but I'm on windows,despite use different server port bootstrap port chromedriver port even udid whether make difference must,2016-12-20 20:31:37,dtabuenc,test_Typescript,0,0,1,0,,[69]
414,415,couldnâ€™t tell you about executables but itâ€™s been great with@types/whatever,appium chromedriverport appium port bootstrap port udid emulators chromedriverport get udid genymotion emulators launch desire emulator type adb devices finally launch test pass additional params port udid platformandroid rspec appiumtest,2016-12-20 20:31:48,subvertallchris,test_Typescript,0,0,1,0,"a s, a type, or type",[69]
415,416,Yes had the same problem with yarn,thank reply,2016-12-20 20:31:50,con-ssc,test_Typescript,0,0,0,1,,[69]
416,417,are you on linux or unix-like ?,work,2016-12-20 20:31:57,dtabuenc,test_Typescript,0,0,1,0,,[69]
417,418,i am,check port use,2016-12-20 20:32:00,subvertallchris,test_Typescript,0,0,1,0,,[69]
418,419,yeah unix works I think.. the@types/bugs are windows related,apart one instance another,2016-12-20 20:32:13,dtabuenc,test_Typescript,0,0,1,0,"an instance, i one",[69]
419,420,"i havenâ€™t had any problems with it at all, been using it for a few weeks now",hmm isnt udid,2016-12-20 20:32:16,subvertallchris,test_Typescript,0,0,1,0,,[69]
420,421,Yarn often left out the package JSON with types,ofcourse use udid port cap,2016-12-20 20:32:16,con-ssc,test_Typescript,0,0,1,0,,[69]
421,422,"Yes, agreed",sorry,2016-12-20 20:32:29,con-ssc,test_Typescript,0,0,1,0,,[69]
422,423,yarn also somehow adds a BOM character in some package.json files that confuses webpack so haven't been able to fully use it yet,yes start server tell udid tell test code,2016-12-20 20:32:45,dtabuenc,test_Typescript,0,0,1,0,t tell,[69]
423,424,More issues on WI does,run test emulators udid emulator emulator know tell appium,2016-12-20 20:32:51,con-ssc,test_Typescript,0,0,1,0,,[69]
424,425,"but hoping to, because it's awesome when it works",parameter set udid emulator well,2016-12-20 20:32:55,dtabuenc,test_Typescript,0,0,1,0,,[69]
425,426,"thatâ€™s a shame. coming from ruby, yarn felt quite familiar and was a nice upgrade over npm",ruby,2016-12-20 20:33:01,subvertallchris,test_Typescript,0,0,1,0,,[69]
426,427,con-ssc: Version Lense is awesome.. thanks for the tip,hmm sure appiumlib check maybe put udid inside file,2016-12-20 20:33:36,dtabuenc,test_Typescript,0,0,1,0,,[69]
427,428,YW,basically tell driver talk port,2016-12-20 20:34:15,con-ssc,test_Typescript,0,0,1,0,,[69]
428,429,"I have to admit, I'm really into all those extensions",figure whatever appium client lib use,2016-12-20 20:35:57,con-ssc,test_Typescript,0,0,1,0,,[69]
429,430,just have to be careful sometimes with some lesser-quality extensions,use javapythonjs,2016-12-20 20:36:16,dtabuenc,test_Typescript,0,0,1,0,,[69]
430,431,making things unstable/crashy,python,2016-12-20 20:36:28,dtabuenc,test_Typescript,0,0,1,0,,[69]
431,432,"Yes absolutely, if you have multiple lenses installed that can have some performance impacts",try set udid something random maybe problem,2016-12-20 20:37:41,con-ssc,test_Typescript,0,0,1,0,,[69]
432,433,Anyone have experience contributing to DefinitelyTyped?,,2016-12-20 21:08:24,subvertallchris,test_Typescript,0,0,1,0,,[69]
433,434,"It looks like I should clone the entire repo (!) and then runnpm test, which appears to run through the entire directory, says â€œTestingâ€¦â€ and then exists silently. I do not expect any errors based on the change I made. Travis is failing on the PR and it seems like it has something to do with TypeScript versions â€” I doubt it was my change. Is this normal?",know whatwho decide udid emulator,2016-12-20 21:13:14,subvertallchris,test_Typescript,0,0,1,0,,[69]
434,435,@mseddon so this is weird. This is what I haveâ€¦ [<-CODE->] then below that code I reference the clndr plugin. When I remove the console.log then clndr is no longer available as a function. Any idea why?,appium maybe work,2016-12-21 17:38:15,jasonbiondo,test_Typescript,0,0,0,0,,[70]
435,436,jasonbiondo: Are you trying to write a decalration file ?,server know exact udid talk driver know udid appium port talk,2016-12-21 17:38:52,dtabuenc,test_Typescript,1,0,0,0,,"[69, 70]"
436,437,Iâ€™m trying to use clndr in my ts file,udid unique per deviceemulator,2016-12-21 17:39:22,jasonbiondo,test_Typescript,0,0,1,0,,[70]
437,438,jasonbiondo: But,nothing appium,2016-12-21 17:39:28,goldenreign,test_Typescript,1,0,0,0,,[70]
438,439,since the declaration file is not available,maybe set create avd,2016-12-21 17:39:35,jasonbiondo,test_Typescript,0,0,1,0,a create,[70]
439,440,jasonbiondo: You need to do something llike this template,yes,2016-12-21 17:40:23,dtabuenc,test_Typescript,1,0,0,0,,[70]
440,441,[<-LINK->],okay try,2016-12-21 17:40:24,dtabuenc,test_Typescript,0,0,1,0,,[70]
441,442,dtabuenc: hmm I see. Seems a bit confusing. Is there a boilerplate example anywhere for converting a jquery plugin?,emulatoravd run,2016-12-21 17:42:21,jasonbiondo,test_Typescript,1,0,0,0,,[70]
442,443,jasonbiondo: what I gave you is pretty close... you'd dodeclare module 'jquery'{ ...],type adb devices give udid,2016-12-21 17:42:59,dtabuenc,test_Typescript,1,0,0,0,a type,[70]
443,444,and add stuff to the interface,thank hardik right back need switch windows macos developmenttesting,2016-12-21 17:43:10,dtabuenc,test_Typescript,0,0,1,0,,[70]
444,445,wouldnâ€™t it be declare module cldnr?,hmm think work way expect,2016-12-21 17:43:21,jasonbiondo,test_Typescript,0,0,1,0,,[70]
445,446,no ...,launch one emulator android andadb devicesgave emulator quit emulator launch another one android time adb devicesalso give emulator,2016-12-21 17:43:29,dtabuenc,test_Typescript,0,0,1,0,"a me, a time, an or, and one",[70]
446,447,you are augmenting jquery,start first emulator android udid appear emulator,2016-12-21 17:43:37,dtabuenc,test_Typescript,0,0,1,0,an or,[70]
447,448,I see,dont know maybe problem appium,2016-12-21 17:43:42,jasonbiondo,test_Typescript,0,0,1,0,a problem,[70]
448,449,here's another problem,idea try use avdargs capability pass port parameter emulator set console port number emulator instance console port number must even integer inclusive must free reserve adb,2016-12-21 22:01:00,johnfn,test_Typescript,0,0,0,1,"a use, even i",[71]
449,450,[<-CODE->],may make udid consistent least,2016-12-21 22:01:09,johnfn,test_Typescript,0,0,1,1,,[71]
450,451,but note that this is fine:,end decide create issue github,2016-12-21 22:02:21,johnfn,test_Typescript,0,0,1,1,create i,[71]
451,452,[<-CODE->],guysegal testid observable effect appium set couple image react native android app appium pagesource didnt change suppose work,2016-12-21 22:02:25,johnfn,test_Typescript,0,0,1,1,,[71]
452,453,and again you actually need to use generics?,forki add properties component prop,2016-12-21 22:15:00,dtabuenc,test_Typescript,0,0,0,1,,[71]
453,454,hahaha,testid testid accessibletrue accessibilitylabeltestid,2016-12-21 22:16:09,johnfn,test_Typescript,0,0,1,1,,"[71, 72]"
454,455,dont you know i just put <T> on all my methods for fun by now? ;-),android work place youll put difficulties understand work ios,2016-12-21 22:16:21,johnfn,test_Typescript,0,0,1,1,,"[71, 72]"
455,456,"alright, let me explain what im doing",component prop reachable appium android always appium ios,2016-12-21 22:16:28,johnfn,test_Typescript,0,0,1,1,a s,"[71, 72]"
456,457,im writing a clone() method,probably something wrong,2016-12-21 22:16:33,johnfn,test_Typescript,0,0,1,1,,"[71, 72]"
457,458,that recursively clones a JS obj,anyone ever execute test two android devices connect appium server get error message,2016-12-21 22:16:44,johnfn,test_Typescript,0,0,1,0,error message,[71]
458,459,so i do something liketype MyObject = number | string | boolean | Buffer,new session create detail problem get session data driver type androiddriver implement get driverdata,2016-12-21 22:17:03,johnfn,test_Typescript,0,0,1,0,"a type, and type",[71]
459,460,"i even have{ [key: string]: MyObject }in there, but it's not really relevant",weird thing test ios android devices connect run successfully,2016-12-21 22:17:22,johnfn,test_Typescript,0,0,1,0,a s,[71]
460,461,"but yeah, the idea is that i want the signature of my clone method to befunction clone<T extends GenericObject>(x: T): T",guysegal find element appium selector,2016-12-21 22:18:08,johnfn,test_Typescript,0,0,1,0,,[71]
461,462,"in order to ensure that when i try to clone something, i've actually written a rule for how it should be cloned, so i dont accidentally try to clone something i can't.",yes use accessibility selector,2016-12-21 22:18:29,johnfn,test_Typescript,0,0,1,0,a use,[71]
462,463,"hopefully that's a simple and understandable use case, perhaps unlike yesterday ;-)",xpath,2016-12-21 22:18:51,johnfn,test_Typescript,0,0,1,0,,[71]
463,464,but you don't have to make x be of type T,always think testid somehow map resourceid,2016-12-21 22:18:53,dtabuenc,test_Typescript,0,0,0,1,,"[71, 72]"
464,465,hm?,anyone use appium node seem directiondownto work,2016-12-21 22:19:02,johnfn,test_Typescript,0,0,1,0,"a use, to work","[71, 73]"
465,466,nevermind I see it now,try use touchaction say yet implement,2016-12-21 22:22:14,dtabuenc,test_Typescript,0,0,1,1,to use,"[71, 74]"
466,467,"write up another issue, they seem to be really responsive.",try use touchaction say yet implement,2016-12-21 22:22:23,dtabuenc,test_Typescript,0,0,1,0,to use,"[72, 74]"
467,468,kk,none touch action implement,2016-12-21 22:22:52,johnfn,test_Typescript,0,0,1,1,,"[73, 75]"
468,469,"since the answer to the last one i got, im kind of scared about typescript",particular touchaction method isnt,2016-12-21 22:23:01,johnfn,test_Typescript,0,0,1,1,m on,"[73, 75]"
469,470,"where it seems okay until you do soemthing complicated and then its like ""heh you cant do that because of really arcane javascript reasons""",dont use node appium use ruby instead,2016-12-21 22:23:21,johnfn,test_Typescript,0,0,1,1,,"[73, 75]"
470,471,"and i cry a little and refresh the ""is web assembly available yet"" page",always use touchaction class scroll,2016-12-21 22:23:38,johnfn,test_Typescript,0,0,1,1,to use,"[73, 75]"
