,id,text,clean,sent,username,chatroom,mention,ngrams,involved,back_and_forth,bigrams,discussionId
0,1,"for those following along, this is the proper way to do the sort of type-safe polymorphism I've been trying for the last few days",guy,2016-11-23 23:24:56,stevekane,test_Typescript,0,0,0,0,,[1]
1,2,very analogous to typeclasses in a language that has them,need help,2016-11-23 23:25:39,stevekane,test_Typescript,0,0,1,0,,[1]
2,3,hey guys,manikandan help,2016-11-27 12:38:30,jacobus-brogly,test_Typescript,0,0,0,0,,[]
3,4,"Hi Guys, how i can find definitions for typescript?",tell need,2016-11-28 04:52:01,Sweet-Bob,test_Typescript,0,0,0,0,,[2]
4,5,maybe exist some service? like npm,package audioimport class trackinfo remotewebdriver driver appiumdriverlocalservice appiumservice string appiumserviceurl,2016-11-28 04:52:48,Sweet-Bob,test_Typescript,0,0,1,0,a package,[2]
5,6,you actually use npm,code use connect appium server,2016-11-28 06:02:22,dtabuenc,test_Typescript,0,0,0,1,,[3]
6,7,as long as you are using typsecript 2.0 +,server run,2016-11-28 06:02:29,dtabuenc,test_Typescript,0,0,1,1,,[3]
7,8,[<-LINK->],help ein,2016-11-28 06:03:15,dtabuenc,test_Typescript,0,0,1,1,,[3]
8,9,so for example if you need types for lodash,appium log,2016-11-28 06:03:35,dtabuenc,test_Typescript,0,0,1,1,,[3]
9,10,you do [<-CODE->],nothing come appium server,2016-11-28 06:03:42,dtabuenc,test_Typescript,0,0,1,0,a me,[3]
10,11,Could somebody give me a helping hand in order to generate a npm module from a typescript library? Which steps would I need to follow?I've created a [<-LINK->] in order to give access to the code.,screenshot,2016-11-28 11:03:59,jeusdi,test_Typescript,0,0,0,0,,[4]
11,12,dtabuenc: basically converts it to mongoose-way,last login tue nov ttysrimm user appiumappium welcome appium appium rest http interface listener start,2016-11-28 11:04:19,serhiisol,test_Typescript,1,0,0,0,a me,[3]
12,13,jeusdi: just adddeclarations: trueto your tsconfig,state,2016-11-28 11:05:30,dtabuenc,test_Typescript,1,0,0,0,,"[3, 4]"
13,14,and addtypes: index.d.tsto your package.config,appiumserviceurl,2016-11-28 11:05:41,dtabuenc,test_Typescript,0,0,1,0,,"[3, 4]"
14,15,dtabuenc: let me a time in order to dive a bit into whatdeclarations: trueandtypes: index.d.tsmeans,remove code,2016-11-28 11:06:56,jeusdi,test_Typescript,1,0,0,0,,"[3, 4]"
15,16,declarations true makestscoutput a.d.tsfile for every.jsfile it outputs,,2016-11-28 11:07:27,dtabuenc,test_Typescript,0,0,1,0,,"[3, 4]"
16,17,andtypesin pacakge.json just points to it,run,2016-11-28 11:07:42,dtabuenc,test_Typescript,0,0,1,0,,"[3, 4]"
17,18,"Mmm, as far I've been able to figure out""*.d.ts""files stand for providing typescript code to javascript libraries, doesn't it?",,2016-11-28 11:10:54,jeusdi,test_Typescript,0,0,1,0,,"[3, 4]"
18,19,"By other side,index.d.tsis generated or is hand-made?",,2016-11-28 11:11:34,jeusdi,test_Typescript,0,0,1,0,,"[3, 4]"
19,20,jeusdi: when you compile ts it produces a.jsbut the js has no information about the types. If you havedeclarations: trueit will also produce a.d.tsfile which has the type information,willl try,2016-11-28 11:12:41,dtabuenc,test_Typescript,1,0,0,0,,"[3, 4]"
20,21,the.d.tsfile is only used if you import that module in another typescript project,change,2016-11-28 11:12:58,dtabuenc,test_Typescript,0,0,1,0,,"[3, 4]"
21,22,Got it!,remotewebdriver,2016-11-28 11:17:44,jeusdi,test_Typescript,0,0,1,0,,"[3, 4]"
22,23,[<-ISSUE->] another@ahejlsbergslamdunk,iosdriver,2016-11-28 18:31:23,stevekane,test_Typescript,0,0,0,0,,[]
23,24,how do I enable generaotrs in tsconfig so when I use async / await in 2.1.1 so my code will take advantage of generators and thus create a lot less trasnpiled code (I am only targeting latest browsers) ?,,2016-11-29 01:20:18,born2net,test_Typescript,0,0,0,1,,[5]
24,25,found it,,2016-11-29 01:21:01,born2net,test_Typescript,0,0,1,1,,[5]
25,26,sorry didn't find it,try say,2016-11-29 01:23:18,born2net,test_Typescript,0,0,1,1,,[5]
26,27,I thought this will do it,,2016-11-29 01:24:50,born2net,test_Typescript,0,0,1,1,,[5]
27,28,[<-CODE->],create issue anyone help,2016-11-29 01:25:01,born2net,test_Typescript,0,0,1,0,"a issue, an issue, create i",[5]
28,29,but still I dont see it taking advantage of generators,guy want test new application need configure webdriver agent,2016-11-29 01:25:17,born2net,test_Typescript,0,0,1,0,a new,[5]
29,30,when used,capability code real device,2016-11-29 01:25:29,born2net,test_Typescript,0,0,1,0,,[5]
30,31,[<-CODE->],guy one help real device capability code,2016-11-29 01:25:37,born2net,test_Typescript,0,0,1,0,,[5]
31,32,same results,guy want test new application need configure webdriver agent,2016-11-29 01:25:39,born2net,test_Typescript,0,0,1,0,a new,[5]
32,33,also tried,capability code real device,2016-11-29 01:29:36,born2net,test_Typescript,0,0,1,0,,[5]
33,34,[<-CODE->],new android development ive learn java past months really like work android app idea anyone help understand need study get concepts clear develop app,2016-11-29 01:29:38,born2net,test_Typescript,0,0,1,0,"a new, like work",[5]
34,35,born2net: you have to target es6,,2016-11-29 01:30:32,dtabuenc,test_Typescript,1,0,0,0,,[5]
35,36,"""target"": ""es6""",heres link want develop sake learn,2016-11-29 01:30:57,dtabuenc,test_Typescript,0,0,1,0,,[5]
36,37,"the""lib""property is just for type declarations from those libs, it doesn't change what's output",,2016-11-29 01:32:07,dtabuenc,test_Typescript,0,0,1,0,,[5]
37,38,can I force typescript to trust a cast?,look question,2016-11-30 02:32:23,stevekane,test_Typescript,0,0,0,0,,[6]
38,39,"What do you mean by ""trust""?",guy one help real device capability code,2016-11-30 02:32:37,Izzmo,test_Typescript,0,0,0,0,,[7]
39,40,"like if I implement a safer function that the type system cannot verify is correct, can I cast it",tell use inspector ios appium,2016-11-30 02:32:40,stevekane,test_Typescript,0,0,1,0,"a s, i use",[6]
40,41,"such that I'm saying ""trust me compiler, this is correct""",achinictwitter,2016-11-30 02:32:47,stevekane,test_Typescript,0,0,1,0,,[6]
41,42,Yes,,2016-11-30 02:32:50,Izzmo,test_Typescript,0,0,1,0,,[7]
42,43,yeah,mgmanikandan thank lot let know one thing clarification enable phone support development xcode due select iphone via accessibility inspector,2016-11-30 02:32:51,dtabuenc,test_Typescript,0,0,0,0,a via,[]
43,44,varunjayaraman: You need to use [<-LINK->] for typescript stack traces in node,connect device launch inspect though view screen,2016-11-30 07:27:37,mika-fischer,test_Typescript,0,0,0,0,,[]
44,45,"Hey! Is@types/angular-mocks removed? npmjs tells me that the latest version is ""0.0.0"" and I can't find it in DT on Github :D",manu thank,2016-11-30 08:28:42,kristho91,test_Typescript,0,0,0,0,,[8]
45,46,[<-LINK->],work great know know keyboard open,2016-11-30 08:39:04,con-ssc,test_Typescript,0,0,0,1,,[8]
46,47,"con-ssc: I see that :) But the latest version is stated as ""0.0.0""",andorid app,2016-11-30 08:39:30,kristho91,test_Typescript,1,0,0,0,,[8]
47,48,well if they use that in their package json so it is,dont think option check keyboard open try catch hide keyboard throw exception mean keyboard already close,2016-11-30 08:39:51,con-ssc,test_Typescript,0,0,1,1,"a keyboard, m on",[8]
48,49,"True, but I can't find it on DT on github, that's why I think they maybe removed it. But could just be a mistake",work,2016-11-30 08:40:28,kristho91,test_Typescript,0,0,1,0,,[8]
49,50,[<-LINK->],languages everyone use write test mochajs ruby python think best,2016-11-30 08:41:40,con-ssc,test_Typescript,0,0,1,1,,[8]
50,51,Oh... It's in another branch :D,languages everyone use write test mochajs ruby python think best,2016-11-30 08:41:43,kristho91,test_Typescript,0,0,1,0,,[8]
51,52,[<-LINK->],use appium android sdk apk installation get error never see beforedevice api level,2016-11-30 08:42:00,con-ssc,test_Typescript,0,0,1,0,a use,[8]
52,53,They pull it from types-2.0 branchs,use appium android sdk apk installation get error never see beforedevice api level,2016-11-30 08:42:11,kristho91,test_Typescript,0,0,1,0,a use,[8]
53,54,can someone check out my code?,use appium android sdk apk installation get error never see beforedevice api level,2016-11-30 19:54:18,jacobus-brogly,test_Typescript,0,0,0,1,a use,"[8, 9]"
54,55,[<-LINK->],use appium android sdk apk installation get error never see beforedevice api level,2016-11-30 19:54:19,jacobus-brogly,test_Typescript,0,0,1,1,a use,"[8, 9]"
55,56,first time I am using TS,use appium android sdk apk installation get error never see beforedevice api level,2016-11-30 19:54:26,jacobus-brogly,test_Typescript,0,0,1,1,a use,"[8, 9]"
56,57,I am interesting in opinions of some senior programmers,use appium android sdk apk installation get error never see beforedevice api level,2016-11-30 19:56:46,jacobus-brogly,test_Typescript,0,0,1,1,a use,"[8, 9]"
57,58,OCD comment: remove your commented code,use appium android sdk apk installation get error never see beforedevice api level,2016-11-30 19:57:19,stevekane,test_Typescript,0,0,0,0,a use,[10]
58,59,??,use appium android sdk apk installation get error never see beforedevice api level,2016-11-30 19:58:23,jacobus-brogly,test_Typescript,0,0,1,0,a use,[9]
59,60,[<-LINK->] tons of commented out content here,use appium android sdk apk installation get error never see beforedevice api level,2016-11-30 19:58:40,stevekane,test_Typescript,0,0,1,0,a use,[10]
60,61,just makes your clarity worse as reviewer and author,use appium android sdk apk installation get error never see beforedevice api level,2016-11-30 19:58:49,stevekane,test_Typescript,0,0,1,0,a use,[10]
61,62,lol,sankleta run appiumdoctor command post log,2016-11-30 19:59:23,jacobus-brogly,test_Typescript,0,0,1,0,command or,[9]
62,63,"thats 30 lines, in a 60 line test program",sankleta run appiumdoctor command post log,2016-11-30 19:59:38,jacobus-brogly,test_Typescript,0,0,1,0,command or,[9]
63,64,using greek letters is charming but ultimately bad for working with your code,info appiumdoctor appium doctor,2016-11-30 19:59:45,dtabuenc,test_Typescript,0,0,0,1,,[9]
64,65,its statistics,info appiumdoctor appium doctor,2016-11-30 19:59:59,jacobus-brogly,test_Typescript,0,0,1,0,,[9]
65,66,sigma,info appiumdoctor appium doctor,2016-11-30 20:00:01,jacobus-brogly,test_Typescript,0,0,1,0,,[9]
66,67,D3 gave me the idea,info appiumdoctor appium doctor,2016-11-30 20:00:07,jacobus-brogly,test_Typescript,0,0,1,0,,[9]
67,68,I know but it just makes it harder to work with it.,info appiumdoctor appium doctor,2016-11-30 20:00:16,dtabuenc,test_Typescript,0,0,1,1,,[9]
68,69,they us greeks like no other,info appiumdoctor appium doctor,2016-11-30 20:00:17,jacobus-brogly,test_Typescript,0,0,1,0,,[9]
69,70,people have to figure ou how to type that on a keyboard.,info appiumdoctor appium doctor,2016-11-30 20:00:23,dtabuenc,test_Typescript,0,0,1,1,,"[9, 11]"
70,71,or alt-code,info appiumdoctor appium doctor,2016-11-30 20:00:24,dtabuenc,test_Typescript,0,0,1,1,,"[9, 11]"
71,72,it's annoying,info appiumdoctor appium doctor,2016-11-30 20:00:26,dtabuenc,test_Typescript,0,0,1,1,,"[9, 11]"
72,73,although it might look visually prettier,info appiumdoctor appium doctor,2016-11-30 20:00:33,dtabuenc,test_Typescript,0,0,1,1,,"[9, 11]"
73,74,"i will keep it, but thanks",info appiumdoctor appium doctor,2016-11-30 20:00:42,jacobus-brogly,test_Typescript,0,0,1,0,,[9]
74,75,I'd rather seelet sigma =,info appiumdoctor appium doctor,2016-11-30 20:00:42,dtabuenc,test_Typescript,0,0,1,0,,[9]
75,76,Maybe do it like es6 with Number.EPSILON,info appiumdoctor appium doctor,2016-11-30 20:00:52,con-ssc,test_Typescript,0,0,0,0,,[]
76,77,sigma is not a constant like PI or Epsilon,info appiumdoctor appium doctor,2016-11-30 20:01:19,jacobus-brogly,test_Typescript,0,0,1,0,,[9]
77,78,Lately I've been also trying to use const more instead of let,info appiumdoctor appium doctor,2016-11-30 20:01:24,dtabuenc,test_Typescript,0,0,1,0,,[9]
78,79,only going to let when I need to,info appiumdoctor appium doctor,2016-11-30 20:01:30,dtabuenc,test_Typescript,0,0,1,0,,[9]
79,80,I agree w/@dtabuencand@jacobus-brogly,info appiumdoctor appium doctor,2016-11-30 20:01:38,stevekane,test_Typescript,1,0,0,0,,[9]
80,81,yes const is pretty handy,info appiumdoctor appium doctor,2016-11-30 20:01:40,con-ssc,test_Typescript,0,0,0,0,,[]
81,82,it seems to catch a lot more problems,info appiumdoctor appium doctor,2016-11-30 20:01:46,dtabuenc,test_Typescript,0,0,1,0,,[9]
82,83,I think symbols are fantastic conceptually and ligatures are a great example of their effectiveness,info appiumdoctor appium doctor,2016-11-30 20:01:52,stevekane,test_Typescript,0,0,1,0,,[9]
83,84,with unintended reference re-assignment,info appiumdoctor appium doctor,2016-11-30 20:01:54,dtabuenc,test_Typescript,0,0,1,0,,[9]
84,85,but they are still challenging to type :/,info appiumdoctor appium doctor,2016-11-30 20:01:59,stevekane,test_Typescript,0,0,1,0,,"[9, 11]"
85,86,"so no comments on structure , templating, .. thats good",info appiumdoctor appium doctor,2016-11-30 20:02:12,jacobus-brogly,test_Typescript,0,0,1,0,,[9]
86,87,So you are going for a rogue-like?,info appiumdoctor appium doctor,2016-11-30 20:02:30,con-ssc,test_Typescript,0,0,0,0,,[]
87,88,we're getting the bike-shedding out of the way first,sankleta post desire cap device android version,2016-11-30 20:02:36,stevekane,test_Typescript,0,0,1,0,,[11]
88,89,we'll start on substance soon,sankleta post desire cap device android version,2016-11-30 20:02:41,stevekane,test_Typescript,0,0,1,0,,[11]
89,90,lol,sure heredef setup desiredcaps desiredcapsplatformname android desiredcapsplatformversion desiredcapsdevicename mrcucumber desiredcapsapp apk device well,2016-11-30 20:03:00,dtabuenc,test_Typescript,0,0,0,0,a me,[12]
90,91,this is very representative of ANY time you ask for feedback lol,sure heredef setup desiredcaps desiredcapsplatformname android desiredcapsplatformversion desiredcapsdevicename mrcucumber desiredcapsapp apk device well,2016-11-30 20:03:21,stevekane,test_Typescript,0,0,1,0,a me,[11]
91,92,I would be looking for a bit more consistency in naming scheme,sankleta try apk seem every look fine need check android source code,2016-11-30 20:03:26,dtabuenc,test_Typescript,0,0,1,0,,[12]
92,93,[<-LINK->],sankleta try apk seem every look fine need check android source code,2016-11-30 20:03:30,jacobus-brogly,test_Typescript,0,0,0,1,,[13]
93,94,the code generates this,try get scroll work python android doesnt seem implement selenium ive search everywhere brain hurt pythonclient source see follow,2016-11-30 20:03:32,jacobus-brogly,test_Typescript,0,0,1,1,a on,[13]
94,95,procedure dungeon map,ive try,2016-11-30 20:03:41,jacobus-brogly,test_Typescript,0,0,1,1,,[13]
95,96,its not done yet,doesnt seem work,2016-11-30 20:03:47,jacobus-brogly,test_Typescript,0,0,1,1,,[13]
96,97,[<-CODE->],one give error say str func,2016-11-30 20:03:53,dtabuenc,test_Typescript,0,0,0,0,,[14]
97,98,That reminds me a bit of Space Quest the board game,test websites apps api help appreciate,2016-11-30 20:03:57,con-ssc,test_Typescript,0,0,0,0,a s,[15]
98,99,the final result should look like this,doesnt work,2016-11-30 20:03:59,jacobus-brogly,test_Typescript,0,0,1,0,,[13]
99,100,some functions are camel-case some are snake-case etc..,get follow,2016-11-30 20:04:11,dtabuenc,test_Typescript,0,0,1,0,,[14]
100,101,an editorconfig and a tslintrc would come in handy,ive luck scroll swipe event try,2016-11-30 20:04:51,con-ssc,test_Typescript,0,0,1,0,,[15]
101,102,[<-LINK->],use mocha though,2016-11-30 20:05:14,jacobus-brogly,test_Typescript,0,0,1,0,,[13]
102,103,the final result should look like this,send example,2016-11-30 20:05:23,jacobus-brogly,test_Typescript,0,0,1,0,,[13]
103,104,"yeah, I mix CamelCase and _",sure,2016-11-30 20:05:38,jacobus-brogly,test_Typescript,0,0,1,0,,[13]
104,105,I think in general your code looks good,thank much,2016-11-30 20:05:45,stevekane,test_Typescript,0,0,0,0,,[16]
105,106,i chaned later in the game,think bald soon,2016-11-30 20:05:45,jacobus-brogly,test_Typescript,0,0,1,0,,"[13, 17]"
106,107,would definiately be nice if you can make it that far,lol,2016-11-30 20:05:51,con-ssc,test_Typescript,0,0,0,0,,[]
107,108,there are a lot of stylistic ways to pick at it,,2016-11-30 20:05:52,stevekane,test_Typescript,0,0,1,0,,"[16, 18]"
108,109,dtabuenc: the naming follows the usage exaclty,thank let try,2016-11-30 20:06:01,jacobus-brogly,test_Typescript,0,0,1,0,,[17]
109,110,and you should probably strive to pull data and rendering concerns apart,beware though mocha python,2016-11-30 20:06:02,stevekane,test_Typescript,0,0,1,1,,"[18, 19]"
110,111,as much as you possibly can,probably tell,2016-11-30 20:06:06,stevekane,test_Typescript,0,0,1,1,,"[18, 19]"
111,112,to find the true data-essence of your model,haha worry try translate,2016-11-30 20:06:13,stevekane,test_Typescript,0,0,1,1,,"[18, 19]"
112,113,as a completely independent concept from HOW you will draw it,thank thank,2016-11-30 20:06:22,stevekane,test_Typescript,0,0,1,1,,"[18, 19]"
113,114,con-ssc: the carpets I am going to place,work,2016-11-30 20:06:45,jacobus-brogly,test_Typescript,0,0,0,0,,[19]
114,115,also you have several 1-liner=>that you don't make 1-liners,ugh nope,2016-11-30 20:06:47,stevekane,test_Typescript,0,0,1,0,,"[18, 20]"
115,116,louse coupling,message yet implement please help,2016-11-30 20:06:52,con-ssc,test_Typescript,0,0,0,0,,[]
116,117,then the fire lamps,simply,2016-11-30 20:07:00,jacobus-brogly,test_Typescript,0,0,1,0,,[19]
117,118,"also as a matter of style, try to put data types at the header of a file",python appium client say,2016-11-30 20:07:13,stevekane,test_Typescript,0,0,1,1,a on,"[20, 21]"
118,119,followed by exported functions/classes,mmcintyre thank try tho,2016-11-30 20:07:20,stevekane,test_Typescript,0,0,1,1,,"[20, 21]"
119,120,then private or non-exported functions/classes,help much python unfortunately tell mocha swipe action part library,2016-11-30 20:07:30,stevekane,test_Typescript,0,0,1,1,a s,"[20, 21]"
120,121,this is purely an arbitrary preference from reading codebases tho,see instrument fail able locate device specify iphone simulator better explicit like provide iphone,2016-11-30 20:07:39,stevekane,test_Typescript,0,0,1,1,"i see, in see, it like","[20, 21]"
121,122,yeah a more C like programming style might make sense,mmcintyre hmm let try mocha take,2016-11-30 20:08:06,jacobus-brogly,test_Typescript,0,0,0,0,a take,[21]
122,123,"Hey guys, quick question. I'm working on creating some type definitions for existing JS-code, and I'm curious if there's a way via module declaration merging that I can update/extend a type alias. The handbookseemsto imply it's possible, but I'm not finding a way to do it?",reywinters good luck,2016-11-30 20:08:09,dlee-nvisia,test_Typescript,0,0,0,0,,[]
123,124,So anyone has a small ts github project or something where I can support ? I want to get my hands dirty a bit,reywinters face still scroll issue,2016-11-30 20:08:25,con-ssc,test_Typescript,0,0,0,0,,[22]
124,125,"its not small, I need to port 5000+ lines of code to TS",mgmanikandan yep,2016-11-30 20:10:02,jacobus-brogly,test_Typescript,0,0,1,1,,"[21, 22]"
125,126,:),reywinters android ios,2016-11-30 20:10:10,con-ssc,test_Typescript,0,0,1,0,a s,[22]
126,127,[<-LINK->],xcode,2016-11-30 20:10:32,jacobus-brogly,test_Typescript,0,0,1,1,,[22]
127,128,That may be too much for me but I could try to contribute,listview androidelement work,2016-11-30 20:10:34,con-ssc,test_Typescript,0,0,1,0,,[22]
128,129,it works,write multiple test start second test give new session create detail problem get session data driver type androiddriver implement get driverdata warn server provide stacktrace informationdo need instantiate,2016-11-30 20:10:35,jacobus-brogly,test_Typescript,0,0,1,1,"a type, and type","[22, 23]"
129,130,oase project works,try override session appium server,2016-11-30 20:10:45,jacobus-brogly,test_Typescript,0,0,1,1,a on,"[22, 23]"
130,131,but still alpha,tekisrinivas work still close app first testcase method,2016-11-30 20:10:49,jacobus-brogly,test_Typescript,0,0,1,1,,"[22, 23]"
131,132,"some 1500+ downloads a month , but in valilla js",ther anyone online,2016-11-30 20:11:08,jacobus-brogly,test_Typescript,0,0,1,1,,"[22, 23]"
132,133,jacobus-brogly: I'd code-golf this project if I were you,start new session possible cause invalid address remote server browser startup get error try automate hybrid app please help,2016-11-30 20:11:29,stevekane,test_Typescript,1,0,0,0,i use,[22]
133,134,well I could try if you want,long script run,2016-11-30 20:11:29,con-ssc,test_Typescript,0,0,1,0,,[22]
134,135,you learn a lot about how to wield the tools,rahul stop appium stop app device start appium,2016-11-30 20:11:34,stevekane,test_Typescript,0,0,1,0,,[22]
135,136,Would be interesting,run daily individually batch run fail pass,2016-11-30 20:11:38,con-ssc,test_Typescript,0,0,1,0,,[22]
136,137,from striving for minimalism in expressing your domain,rahulchulliparambil post cap,2016-11-30 20:11:40,stevekane,test_Typescript,0,0,1,0,,[22]
137,138,"your code already trends that direction, so I'd encourage you to further compress it",cap mean,2016-11-30 20:11:56,stevekane,test_Typescript,0,0,1,0,,[22]
138,139,code-golf? wtf is that?,desire capabilities,2016-11-30 20:11:58,jacobus-brogly,test_Typescript,0,0,1,0,,[22]
139,140,[<-LINK->],,2016-11-30 20:12:07,stevekane,test_Typescript,0,0,1,0,,[22]
140,141,But then I'd really need a editorconfig and a tslintrc,,2016-11-30 20:12:10,con-ssc,test_Typescript,0,0,1,0,,[22]
141,142,"read this post at some point, it's excellent",new urlurl,2016-11-30 20:12:14,stevekane,test_Typescript,0,0,1,0,,[22]
142,143,mm ok,url,2016-11-30 20:12:50,jacobus-brogly,test_Typescript,0,0,1,0,,[22]
143,144,"ok, back to coding, see you later folks",divyatfw yes individually work fine,2016-11-30 20:16:28,jacobus-brogly,test_Typescript,0,0,1,0,,[22]
144,145,anyone know how to override Webpack Dev Server complaints about errors while compiling so a reload was prevented,web driver work hybrid app,2016-12-01 20:56:19,varunjayaraman,test_Typescript,0,0,0,1,,"[22, 23]"
145,146,there was a typescript error but it's non fatal,driver new androiddrivernew urlurl,2016-12-01 20:56:31,varunjayaraman,test_Typescript,0,0,1,1,a new,"[22, 23]"
146,147,it's just like property x can't exist on type {} or whatever,ask url params,2016-12-01 20:56:46,varunjayaraman,test_Typescript,0,0,1,1,,"[22, 23]"
147,148,because i modified an object after i declared it,appium url,2016-12-01 20:56:55,varunjayaraman,test_Typescript,0,0,1,1,,"[22, 23]"
148,149,if you use awesome-typescript-loader with fork checker plugin you can split type checking from compilation,public class firstappiumtrial,2016-12-01 21:00:57,dtabuenc,test_Typescript,0,0,0,0,,[24]
149,150,for ts-loader I think there's an option to not do type checking,appium log,2016-12-01 21:01:08,dtabuenc,test_Typescript,0,0,1,0,,"[24, 25]"
150,151,what about other errors that are not typescript-related?,actually new appium dont know much appium log mean,2016-12-01 21:01:32,varunjayaraman,test_Typescript,0,0,1,0,a new,[23]
151,152,actually ts-loader won't propogate errros to webpack so it will build fine even if you have a few type errors,start appium,2016-12-01 21:02:26,dtabuenc,test_Typescript,0,0,1,0,,"[24, 26]"
152,153,Anybody have a good example of TSX/React? Having hell clearing my terminal of[at-loader]errors. -_-,divyatfw run code eclipse,2016-12-01 23:45:04,colshacol,test_Typescript,0,0,0,1,,[25]
153,154,colshacol: It's probably better you share what type of errors you are seeing.,mgmanikandan yes start,2016-12-01 23:46:09,dtabuenc,test_Typescript,1,0,0,0,,"[25, 26]"
154,155,"I was receivingcannot find module ""...""on everything, but I switched fromimport ... from ...torequire()and those are gone.",divyatfw try start apium server override exist session,2016-12-01 23:47:04,colshacol,test_Typescript,0,0,1,1,,[25]
155,156,Right now I am working to clear these out: [<-CODE->],mgmanikandan delete cache data start run alternative problem,2016-12-01 23:47:21,colshacol,test_Typescript,0,0,1,1,a s,[25]
156,157,colshacol: sounds like you are missing typing definitions for modules,override exist session option appium shud add capabilit,2016-12-01 23:47:22,dtabuenc,test_Typescript,1,0,0,0,a on,"[25, 27]"
157,158,"It was mostly on.sassfiles, as I am using CSSModules.",apium server settings find override exist session check boxu check,2016-12-01 23:47:44,colshacol,test_Typescript,0,0,1,1,,[25]
158,159,does props exist on DeatilsView?,rahulchulliparambil use gui command line tool,2016-12-01 23:47:45,dtabuenc,test_Typescript,0,0,1,0,,[27]
159,160,[<-CODE->],let check,2016-12-01 23:47:49,stevekane,test_Typescript,0,0,0,0,,[28]
160,161,the above works because scope of the fn is constrained to the else-block,,2016-12-01 23:48:04,stevekane,test_Typescript,0,0,1,0,,"[28, 29]"
161,162,kind of gross...,divyatfw override exist session mean override exit session next run win create new session,2016-12-01 23:48:06,stevekane,test_Typescript,0,0,1,0,m on,"[28, 30]"
162,163,[<-CODE->],script fail guess new session create evry time run script since rid thing fail abort execution,2016-12-01 23:48:27,colshacol,test_Typescript,0,0,0,1,,"[29, 30]"
163,164,Theprops: anything is just my latest tinker to try to get this to resolve.,divyatfw post appium full log,2016-12-01 23:48:47,colshacol,test_Typescript,0,0,1,1,,"[29, 30]"
164,165,i think you want any,log throw error element find continue next script,2016-12-01 23:49:16,stevekane,test_Typescript,0,0,1,1,,"[29, 30, 31]"
165,166,only,post whole appium log,2016-12-01 23:49:18,stevekane,test_Typescript,0,0,1,1,,"[29, 30, 31]"
166,167,not { props: any },post let give run send,2016-12-01 23:49:20,stevekane,test_Typescript,0,0,1,1,,"[29, 30, 31]"
167,168,[<-LINK->] see here for example,,2016-12-01 23:49:34,stevekane,test_Typescript,0,0,1,1,,"[29, 30, 31]"
